{
  "adds_new_generation_direction": false,
  "artifact_type": "qc_report",
  "checked_assets": [
    "main_01.png",
    "main_02.png",
    "main_03.png",
    "main_04.png",
    "main_05.png",
    "main_06.png",
    "detail_01.png",
    "detail_02.png",
    "detail_03.png",
    "detail_04.png",
    "detail_05.png",
    "detail_06.png",
    "detail_07.png",
    "detail_08.png"
  ],
  "issues": [
    {
      "affected_asset": "main_01.png",
      "category": "composition",
      "description": "产品占画面高度明显低于main_01要求的55%至65%，主图主体识别权重不足。",
      "issue_id": "issue_001",
      "severity": "major"
    },
    {
      "affected_asset": "main_02.png",
      "category": "product_angle",
      "description": "产品被生成成横向侧放状态，偏离B槽位直立杯口朝上的绑定角度。",
      "issue_id": "issue_002",
      "severity": "critical"
    },
    {
      "affected_asset": "main_02.png",
      "category": "page_task",
      "description": "横向侧放导致main_02无法稳定完成近中景质感识别和直立杯口把手展示任务。",
      "issue_id": "issue_003",
      "severity": "major"
    },
    {
      "affected_asset": "main_02.png",
      "category": "realism",
      "description": "产品以杯口边缘和把手形成异常支撑，接触与受力关系不真实。",
      "issue_id": "issue_004",
      "severity": "major"
    },
    {
      "affected_asset": "main_02.png",
      "category": "text",
      "description": "画面文字为“竖纹釉色杯”，与指定文字“竖纹釉色杯”不一致。",
      "issue_id": "issue_005",
      "severity": "major"
    },
    {
      "affected_asset": "main_02.png",
      "category": "ai_artifacts",
      "description": "侧倒姿态造成产品与桌面支撑关系异常，存在明显AI物理痕迹。",
      "issue_id": "issue_006",
      "severity": "major"
    },
    {
      "affected_asset": "main_05.png",
      "category": "composition",
      "description": "main_05.png 的杯子本体占比明显低于本张要求的约画面高度58%至68%，产品主体权重不足。",
      "issue_id": "issue_c03_main05_composition_01",
      "severity": "major"
    },
    {
      "affected_asset": "detail_01.png",
      "category": "composition",
      "description": "detail_01.png 的产品主体高度占比低于本张要求的50%至60%，首屏商品识别权重不足。",
      "issue_id": "qc4_detail01_composition_001",
      "severity": "major"
    },
    {
      "affected_asset": "detail_02.png",
      "category": "composition",
      "description": "detail_02.png 的产品主体高度占比低于本张要求的60%至70%，近中景核心卖点证明力度不足。",
      "issue_id": "qc4_detail02_composition_001",
      "severity": "major"
    },
    {
      "affected_asset": "detail_04.png",
      "category": "text",
      "description": "detail_04.png将字段标签“卖点短语：”渲染进画面，超出正式文字要求，属于流程标签误入成片。",
      "issue_id": "issue_5_001",
      "severity": "major"
    },
    {
      "affected_asset": "detail_05.png",
      "category": "product_identity",
      "description": "杯身比例被压成矮宽形态，口径相对杯身高度过大，偏离产品身份档案中的较高筒状开口杯比例。",
      "issue_id": "qc6_d05_identity_001",
      "severity": "major"
    },
    {
      "affected_asset": "detail_05.png",
      "category": "composition",
      "description": "产品主体位于画面下半部且面积过小，大量留白导致规格尺寸说明页的商品主体弱化。",
      "issue_id": "qc6_d05_composition_001",
      "severity": "major"
    },
    {
      "affected_asset": "detail_05.png",
      "category": "size_ratio",
      "description": "产品可见高度明显未达到本张要求的画面高度 58% 至 68%。",
      "issue_id": "qc6_d05_size_ratio_001",
      "severity": "major"
    },
    {
      "affected_asset": "detail_06.png",
      "category": "product_angle",
      "description": "当前图把手侧向与 B 槽位绑定图存在疑似镜像风险，需要人工核对后决定是否返修角度。",
      "issue_id": "qc6_d06_angle_review_001",
      "severity": "needs_review"
    },
    {
      "affected_asset": "detail_06.png",
      "category": "size_ratio",
      "description": "产品可见高度明显未达到本张要求的画面高度 62% 至 72%。",
      "issue_id": "qc6_d06_size_ratio_001",
      "severity": "major"
    },
    {
      "affected_asset": "main_02.png",
      "category": "product_angle",
      "description": "main_02横向侧放破坏主图组直立杯口朝上的统一商品展示关系，导致主图集合一致性失败。",
      "issue_id": "issue_c08_main_set_001",
      "severity": "critical"
    },
    {
      "affected_asset": "detail_05.png",
      "category": "product_identity",
      "description": "detail_05杯身矮宽比例、主体过小和规格页占比不足叠加，削弱详情模块链中规格说明节点的商品可信度。",
      "issue_id": "issue_c08_detail_chain_001",
      "severity": "major"
    },
    {
      "affected_asset": "detail_04.png",
      "category": "text",
      "description": "detail_04将字段标签渲染进画面，叠加多张占比和角度待核对问题，使全批暂不满足直接上架交付状态。",
      "issue_id": "issue_c08_readiness_001",
      "severity": "major"
    }
  ],
  "notes": "QC 仅判断现有 14 张图片并给出返修归因；未新增生成方向。",
  "product_id": "杯子_20260722",
  "repair_targets": [
    {
      "affected_asset": "main_01.png",
      "issue_id": "issue_001",
      "repair_goal": "仅修正main_01产品主体占比不足问题，保持产品身份、B槽位角度、空置状态、无文字和生活化桌面风格不变。",
      "return_stage": "variable_config",
      "severity": "major",
      "target_id": "repair_001"
    },
    {
      "affected_asset": "main_02.png",
      "issue_id": "issue_002",
      "repair_goal": "仅修正main_02产品角度，恢复B槽位直立、杯口朝上、侧前方斜视关系，不改变产品身份和颜色。",
      "return_stage": "variable_config",
      "severity": "critical",
      "target_id": "repair_002"
    },
    {
      "affected_asset": "main_02.png",
      "issue_id": "issue_003",
      "repair_goal": "仅恢复main_02近中景质感识别主图任务，使杯口、条纹和把手在直立状态下完整可见。",
      "return_stage": "variable_config",
      "severity": "major",
      "target_id": "repair_003"
    },
    {
      "affected_asset": "main_02.png",
      "issue_id": "issue_004",
      "repair_goal": "仅修正main_02不可信支撑和接触关系，使杯子真实落在织物桌面上并形成合理接触阴影。",
      "return_stage": "realism",
      "severity": "major",
      "target_id": "repair_004"
    },
    {
      "affected_asset": "main_02.png",
      "issue_id": "issue_005",
      "repair_goal": "仅修正main_02文字错字，画面只保留指定短标题“竖纹釉色杯”，不添加其他文字或承诺。",
      "return_stage": "final_prompt",
      "severity": "major",
      "target_id": "repair_005"
    },
    {
      "affected_asset": "main_02.png",
      "issue_id": "issue_006",
      "repair_goal": "仅消除main_02侧倒造成的物理异常和AI痕迹，保持真实商业摄影接触关系。",
      "return_stage": "realism",
      "severity": "major",
      "target_id": "repair_006"
    },
    {
      "affected_asset": "main_05.png",
      "issue_id": "issue_c03_main05_composition_01",
      "repair_goal": "仅强化已存在的主体占比与构图约束，使杯子本体回到约画面高度58%至68%，不改变手持页面任务、产品身份、角度或道具方向。",
      "return_stage": "final_prompt",
      "severity": "major",
      "target_id": "repair_c03_main05_composition_01"
    },
    {
      "affected_asset": "detail_01.png",
      "issue_id": "qc4_detail01_composition_001",
      "repair_goal": "仅修复主体高度占比不足问题，保持产品身份、角度、颜色、文字和道具边界不变。",
      "return_stage": "final_prompt",
      "severity": "major",
      "target_id": "repair4_detail01_composition_001"
    },
    {
      "affected_asset": "detail_02.png",
      "issue_id": "qc4_detail02_composition_001",
      "repair_goal": "仅修复主体高度占比不足问题，保持产品身份、角度、颜色、文字和道具边界不变。",
      "return_stage": "final_prompt",
      "severity": "major",
      "target_id": "repair4_detail02_composition_001"
    },
    {
      "affected_asset": "detail_04.png",
      "issue_id": "issue_5_001",
      "repair_goal": "仅去除画面中的“卖点短语：”字段标签，保留低干扰文字“杯口与内壁细节可见”及现有产品角度、身份、构图和风格。",
      "return_stage": "final_prompt",
      "severity": "major",
      "target_id": "repair_5_001"
    },
    {
      "affected_asset": "detail_05.png",
      "issue_id": "qc6_d05_identity_001",
      "repair_goal": "按已锁定产品身份恢复较高筒状杯身、圆形杯口、竖向条纹和把手比例，不新增结构或卖点。",
      "return_stage": "final_prompt",
      "severity": "major",
      "target_id": "repair_qc6_d05_identity_001"
    },
    {
      "affected_asset": "detail_05.png",
      "issue_id": "qc6_d05_composition_001",
      "repair_goal": "按现有规格标注图任务恢复产品中部略偏左、侧边标注留白和清晰主体，不新增信息模块。",
      "return_stage": "final_prompt",
      "severity": "major",
      "target_id": "repair_qc6_d05_composition_001"
    },
    {
      "affected_asset": "detail_05.png",
      "issue_id": "qc6_d05_size_ratio_001",
      "repair_goal": "仅把产品可见高度恢复到既定 58% 至 68% 画面高度范围，保持现有高度文字和单一标注线。",
      "return_stage": "final_prompt",
      "severity": "major",
      "target_id": "repair_qc6_d05_size_ratio_001"
    },
    {
      "affected_asset": "detail_06.png",
      "issue_id": "qc6_d06_angle_review_001",
      "repair_goal": "先核对 B 槽位绑定图的把手侧向关系；若确认镜像，只恢复绑定角度，不改变产品身份。",
      "return_stage": "angle_inventory",
      "severity": "needs_review",
      "target_id": "repair_qc6_d06_angle_review_001"
    },
    {
      "affected_asset": "detail_06.png",
      "issue_id": "qc6_d06_size_ratio_001",
      "repair_goal": "仅把产品可见高度恢复到既定 62% 至 72% 画面高度范围，保持无文字质感展示任务。",
      "return_stage": "final_prompt",
      "severity": "major",
      "target_id": "repair_qc6_d06_size_ratio_001"
    },
    {
      "affected_asset": "main_02.png",
      "issue_id": "issue_c08_main_set_001",
      "repair_goal": "仅恢复main_02为B槽位直立、杯口朝上、侧前方斜视的主图关系，使主图组回到统一商品展示状态。",
      "return_stage": "variable_config",
      "severity": "critical",
      "target_id": "repair_c08_main_set_001"
    },
    {
      "affected_asset": "detail_05.png",
      "issue_id": "issue_c08_detail_chain_001",
      "repair_goal": "仅恢复detail_05较高筒状杯身比例、主体占比和规格说明构图，不新增规格信息或新卖点。",
      "return_stage": "final_prompt",
      "severity": "major",
      "target_id": "repair_c08_detail_chain_001"
    },
    {
      "affected_asset": "detail_04.png",
      "issue_id": "issue_c08_readiness_001",
      "repair_goal": "仅去除detail_04误入画面的字段标签，并在完成既有返修项后再复核全批平台就绪状态。",
      "return_stage": "final_prompt",
      "severity": "major",
      "target_id": "repair_c08_readiness_001"
    }
  ],
  "results": [
    {
      "affected_asset": "main_01.png",
      "check_item": "product_identity",
      "notes": "单个带把手开口杯身份清楚，竖向条纹、深色杯口边缘和斑点把手保留，未见杯盖、吸管、滤网或包装。",
      "status": "pass"
    },
    {
      "affected_asset": "main_01.png",
      "check_item": "product_color",
      "notes": "杯身浅暖色、杯口和把手深焦糖棕色分区清楚，未见明显整体偏色。",
      "status": "pass"
    },
    {
      "affected_asset": "main_01.png",
      "check_item": "product_angle",
      "notes": "呈侧前方斜视，可见杯身侧面、部分杯内壁和侧面把手，符合B槽位可见关系。",
      "status": "pass"
    },
    {
      "affected_asset": "main_01.png",
      "check_item": "page_task",
      "notes": "能作为生活化主图第一印象，第一眼可识别单个带把手杯子。",